[
  {
    "id": "wilde-the-artist",
    "title": "The Artist",
    "author": "Oscar Wilde",
    "author_death_year": 1900,
    "first_published_year": 1894,
    "original_language": "en",
    "genre": "prose_poem",
    "description": "A short allegory about transforming enduring sorrow into fleeting pleasure, first published in Poems in Prose (1894).",
    "visibility": "public",
    "translation_gap": {
      "status": "unverified",
      "notes": "Pilot selected for provenance and editorial workflow; no claim that translations are missing or inadequate."
    }
  },
  {
    "id": "demo-proust",
    "title": "Du côté de chez Swann",
    "author": "Marcel Proust",
    "author_death_year": 1922,
    "first_published_year": 1913,
    "original_language": "fr",
    "genre": "novel",
    "description": "An intentionally incomplete, unverified demonstration retained to preserve existing reference URLs.",
    "visibility": "demo",
    "translation_gap": {
      "status": "unverified",
      "notes": "Demonstration only."
    }
  },
  {
    "id": "machado-um-apologo",
    "title": "Um Apólogo",
    "author": "Machado de Assis",
    "author_death_year": 1908,
    "first_published_year": 1885,
    "original_language": "pt",
    "genre": "short_story",
    "description": "A needle and a thread dispute who deserves the credit in a brief Brazilian satire of labor, vanity and social advancement.",
    "visibility": "public",
    "translation_gap": {
      "status": "unverified",
      "notes": "Selected as a bounded direct-translation and editorial feasibility pilot after Translation Gap Atlas research. No exact Vietnamese or Indonesian version was located in the recorded bounded searches; that is not proof of absence, inaccessibility or inadequate quality. Reader demand and qualified reviewer capacity remain unverified."
    }
  },
  {
    "id": "pardo-bazan-el-encaje-roto",
    "title": "El encaje roto",
    "author": "Emilia Pardo Bazán",
    "author_death_year": 1921,
    "first_published_year": 1897,
    "original_language": "es",
    "genre": "short_story",
    "description": "A bride refuses her vows; years later she explains a fleeting glimpse of her fiancé’s character. A Spanish story about social appearances and a woman’s power to refuse.",
    "visibility": "public",
    "translation_gap": {
      "status": "unverified",
      "notes": "Selected as a bounded direct-translation and editorial feasibility pilot after Translation Gap Atlas research. No exact Vietnamese or Indonesian version was located in the recorded bounded searches; that is not proof of absence, inaccessibility or inadequate quality. Reader demand and qualified reviewer capacity remain unverified."
    }
  },
  {
    "id": "chopin-story-of-an-hour",
    "title": "The Story of an Hour",
    "author": "Kate Chopin",
    "author_death_year": 1904,
    "first_published_year": 1894,
    "original_language": "en",
    "genre": "short_story",
    "description": "A woman receives news of her husband’s death; her private thoughts and the public explanation of what follows diverge.",
    "visibility": "public",
    "translation_gap": {
      "status": "unverified",
      "notes": "The Translation Gap Atlas already records an existing credited Vietnamese translation. This is a new direct, openly reusable and aligned edition, not a claim of first translation, a missing Vietnamese version or a demonstrated quality deficiency."
    }
  },
  {
    "id": "saki-the-open-window",
    "title": "The Open Window",
    "author": "Saki (H. H. Munro)",
    "author_death_year": 1916,
    "first_published_year": 1911,
    "original_language": "en",
    "genre": "short_story",
    "description": "A nervous visitor hears a young hostess’s account of an open window in a short satire of social manners, credulity and invention.",
    "visibility": "public",
    "translation_gap": {
      "status": "unverified",
      "notes": "Chosen for a complete, directly sourced and openly reusable Vietnamese edition. Existing Vietnamese translations, their quality and reader demand have not been comprehensively assessed; no absence or superiority claim is made."
    }
  }
]
